{
  "schema_version": 1,
  "generated_at": "2026-10-24T08:05:49.541099+00:00",
  "deals": [
    {
      "display_name": "Bali, Indonesia",
      "route_key": "JFK:Bali, Indonesia",
      "origin": "JFK",
      "group": "long_haul",
      "price": 507,
      "booking_link": "https://www.aviasales.com/search/JFK0103DPS17031?marker=314524",
      "airline": "OZ",
      "departure_at": "2027-03-01T10:30:00-05:00",
      "return_at": "2027-03-17T01:20:00+08:00",
      "history_points": 31,
      "price_history": [
        866,
        813,
        819,
        819,
        819,
        819,
        819,
        808,
        808,
        808,
        807,
        808,
        808,
        808,
        832,
        491,
        491,
        491,
        491,
        491,
        491,
        491,
        821,
        821,
        821,
        821,
        821,
        821,
        821,
        821,
        873
      ],
      "observations": [
        {
          "date": "2026-09-23",
          "price": 866,
          "found_at": "2026-09-23T10:43:50.787921+00:00",
          "expires_at": "2026-09-23T11:43:50Z"
        },
        {
          "date": "2026-09-24",
          "price": 813,
          "found_at": "2026-09-24T11:04:29.829172+00:00",
          "expires_at": "2026-09-24T12:04:29Z"
        },
        {
          "date": "2026-09-25",
          "price": 819,
          "found_at": "2026-09-25T11:05:17.181540+00:00",
          "expires_at": "2026-09-25T12:05:17Z"
        },
        {
          "date": "2026-09-26",
          "price": 819,
          "found_at": "2026-09-26T10:46:35.110033+00:00",
          "expires_at": "2026-09-26T11:46:35Z"
        },
        {
          "date": "2026-09-27",
          "price": 819,
          "found_at": "2026-09-27T11:21:34.077925+00:00",
          "expires_at": "2026-09-27T12:21:34Z"
        },
        {
          "date": "2026-09-28",
          "price": 819,
          "found_at": "2026-09-28T12:51:06.304339+00:00",
          "expires_at": "2026-09-28T13:51:06Z"
        },
        {
          "date": "2026-09-29",
          "price": 819,
          "found_at": "2026-09-29T12:05:14.114169+00:00",
          "expires_at": "2026-09-29T13:05:14Z"
        },
        {
          "date": "2026-09-30",
          "price": 808,
          "found_at": "2026-09-30T11:53:05.966514+00:00",
          "expires_at": "2026-09-30T12:53:06Z"
        },
        {
          "date": "2026-10-01",
          "price": 808,
          "found_at": "2026-10-01T12:23:45.106146+00:00",
          "expires_at": "2026-10-01T13:23:45Z"
        },
        {
          "date": "2026-10-02",
          "price": 808,
          "found_at": "2026-10-02T11:50:45.918557+00:00",
          "expires_at": "2026-10-02T12:50:46Z"
        },
        {
          "date": "2026-10-03",
          "price": 807,
          "found_at": "2026-10-03T11:04:00.341596+00:00",
          "expires_at": "2026-10-03T12:04:00Z"
        },
        {
          "date": "2026-10-04",
          "price": 808,
          "found_at": "2026-10-04T11:45:18.851692+00:00",
          "expires_at": "2026-10-04T12:45:19Z"
        },
        {
          "date": "2026-10-05",
          "price": 808,
          "found_at": "2026-10-05T13:32:30.120631+00:00",
          "expires_at": "2026-10-05T14:32:30Z"
        },
        {
          "date": "2026-10-06",
          "price": 808,
          "found_at": "2026-10-06T12:43:02.854168+00:00",
          "expires_at": "2026-10-06T13:43:03Z"
        },
        {
          "date": "2026-10-07",
          "price": 832,
          "found_at": "2026-10-07T12:22:31.160421+00:00",
          "expires_at": "2026-10-07T13:22:31Z"
        },
        {
          "date": "2026-10-08",
          "price": 491,
          "found_at": "2026-10-08T04:51:16.838018+00:00",
          "expires_at": "2026-10-08T05:51:16Z"
        },
        {
          "date": "2026-10-09",
          "price": 491,
          "found_at": "2026-10-09T06:59:29.056594+00:00",
          "expires_at": "2026-10-09T07:59:29Z"
        },
        {
          "date": "2026-10-10",
          "price": 491,
          "found_at": "2026-10-10T09:46:59.964367+00:00",
          "expires_at": "2026-10-10T10:47:00Z"
        },
        {
          "date": "2026-10-11",
          "price": 491,
          "found_at": "2026-10-11T09:57:05.463999+00:00",
          "expires_at": "2026-10-11T10:57:05Z"
        },
        {
          "date": "2026-10-12",
          "price": 491,
          "found_at": "2026-10-12T10:43:39.181516+00:00",
          "expires_at": "2026-10-12T11:43:39Z"
        },
        {
          "date": "2026-10-13",
          "price": 491,
          "found_at": "2026-10-13T10:30:51.158153+00:00",
          "expires_at": "2026-10-13T11:30:51Z"
        },
        {
          "date": "2026-10-14",
          "price": 491,
          "found_at": "2026-10-14T08:39:35.424122+00:00",
          "expires_at": "2026-10-14T09:39:35Z"
        },
        {
          "date": "2026-10-15",
          "price": 821,
          "found_at": "2026-10-15T08:14:55.393884+00:00",
          "expires_at": "2026-10-15T09:14:55Z"
        },
        {
          "date": "2026-10-16",
          "price": 821,
          "found_at": "2026-10-16T08:07:22.311319+00:00",
          "expires_at": "2026-10-16T09:07:23Z"
        },
        {
          "date": "2026-10-17",
          "price": 821,
          "found_at": "2026-10-17T07:44:44.360817+00:00",
          "expires_at": "2026-10-17T08:44:44Z"
        },
        {
          "date": "2026-10-18",
          "price": 821,
          "found_at": "2026-10-18T07:58:50.603696+00:00",
          "expires_at": "2026-10-18T08:58:50Z"
        },
        {
          "date": "2026-10-19",
          "price": 821,
          "found_at": "2026-10-19T08:47:56.860184+00:00",
          "expires_at": "2026-10-19T09:47:57Z"
        },
        {
          "date": "2026-10-20",
          "price": 821,
          "found_at": "2026-10-20T08:28:27.899028+00:00",
          "expires_at": "2026-10-20T09:28:28Z"
        },
        {
          "date": "2026-10-21",
          "price": 821,
          "found_at": "2026-10-21T08:30:57.007814+00:00",
          "expires_at": "2026-10-21T09:30:57Z"
        },
        {
          "date": "2026-10-22",
          "price": 821,
          "found_at": "2026-10-22T08:33:19.540157+00:00",
          "expires_at": "2026-10-22T09:33:19Z"
        },
        {
          "date": "2026-10-23",
          "price": 873,
          "found_at": "2026-10-23T08:29:26.649144+00:00",
          "expires_at": "2026-10-23T09:29:26Z"
        }
      ],
      "found_at": "2026-10-24T08:04:23.733964+00:00",
      "expires_at": "2026-10-24T09:04:23Z",
      "trailing_avg": 746.42,
      "median_baseline": 819,
      "pct_below_avg": 0.3208,
      "status": "deal",
      "basis_text": "38% below 30-day median, 31 observations",
      "is_stale_fallback": false,
      "last_fresh_date": "2026-10-24"
    }
  ],
  "featured": [
    {
      "display_name": "Marrakech, Morocco",
      "route_key": "JFK:Marrakech, Morocco",
      "origin": "JFK",
      "group": "featured",
      "price": 548,
      "booking_link": "https://www.aviasales.com/search/JFK1311RAK21111?marker=314524",
      "airline": "TP",
      "departure_at": "2026-11-13T22:00:00-05:00",
      "return_at": "2026-11-21T11:45:00+01:00",
      "history_points": 31,
      "price_history": [
        585,
        585,
        585,
        585,
        585,
        618,
        618,
        618,
        618,
        644,
        644,
        644,
        644,
        644,
        685,
        685,
        685,
        685,
        685,
        685,
        685,
        514,
        514,
        514,
        514,
        514,
        514,
        514,
        502,
        502,
        548
      ],
      "observations": [
        {
          "date": "2026-09-23",
          "price": 585,
          "found_at": "2026-09-23T10:43:50.787921+00:00",
          "expires_at": "2026-09-23T11:44:54Z"
        },
        {
          "date": "2026-09-24",
          "price": 585,
          "found_at": "2026-09-24T11:04:29.829172+00:00",
          "expires_at": "2026-09-24T12:05:34Z"
        },
        {
          "date": "2026-09-25",
          "price": 585,
          "found_at": "2026-09-25T11:05:17.181540+00:00",
          "expires_at": "2026-09-25T12:06:21Z"
        },
        {
          "date": "2026-09-26",
          "price": 585,
          "found_at": "2026-09-26T10:46:35.110033+00:00",
          "expires_at": "2026-09-26T11:47:41Z"
        },
        {
          "date": "2026-09-27",
          "price": 585,
          "found_at": "2026-09-27T11:21:34.077925+00:00",
          "expires_at": "2026-09-27T12:22:38Z"
        },
        {
          "date": "2026-09-28",
          "price": 618,
          "found_at": "2026-09-28T12:51:06.304339+00:00",
          "expires_at": "2026-09-28T13:52:12Z"
        },
        {
          "date": "2026-09-29",
          "price": 618,
          "found_at": "2026-09-29T12:05:14.114169+00:00",
          "expires_at": "2026-09-29T13:06:18Z"
        },
        {
          "date": "2026-09-30",
          "price": 618,
          "found_at": "2026-09-30T11:53:05.966514+00:00",
          "expires_at": "2026-09-30T12:54:10Z"
        },
        {
          "date": "2026-10-01",
          "price": 618,
          "found_at": "2026-10-01T12:23:45.106146+00:00",
          "expires_at": "2026-10-01T13:24:48Z"
        },
        {
          "date": "2026-10-02",
          "price": 644,
          "found_at": "2026-10-02T11:50:45.918557+00:00",
          "expires_at": "2026-10-02T12:51:51Z"
        },
        {
          "date": "2026-10-03",
          "price": 644,
          "found_at": "2026-10-03T11:04:00.341596+00:00",
          "expires_at": "2026-10-03T12:05:04Z"
        },
        {
          "date": "2026-10-04",
          "price": 644,
          "found_at": "2026-10-04T11:45:18.851692+00:00",